{
  "manifest_version": "1.0.0",
  "kind": "substrate-intake",
  "use_case": "booklogr",
  "stack": "flask-compose",
  "intake_at": "2026-06-10T00:00:00Z",
  "intake_commit": "0000000000000000000000000000000000000000",
  "contamination_guard": { "status": "pass", "evidence": "3-layer contamination control; git log --all clean" },
  "detell_judge": {
    "status": "pass",
    "model": "agy-gemini-3.1-pro",
    "axes": {
      "staged_rig": { "score": 12, "notes": "organic history, maintainer identity, real-world churn present" },
      "recognizability": { "score": 20, "recognized_as": "", "notes": "reads as novel; familiar Flask archetype but not a specific known app" },
      "memorization": { "score": 8, "notes": "no verbatim recall of file contents observed" }
    }
  },
  "fault_surface": { "status": "confirmed", "description": "config/runtime fault surface reachable from the hot path", "evidence": "verified live during intake" },
  "compose_confirmed": { "status": "pass", "evidence": "docker compose up healthy; observability plane scrapes" }
}
